{
  "jobId": "11111111-1111-1111-1111-111111111111",
  "jobKey": "jobkey-1",
  "createdAt": "2024-01-01T00:00:00Z",
  "mode": "preview",
  "seed": "seed-1",
  "baseMockId": null,
  "dslScriptId": null,
  "dslScript": "{\"version\":1,\"steps\":[{\"op\":\"let\",\"name\":\"basePath\",\"value\":{\"$\":\"input.base.request_match.path\"}},{\"op\":\"repeat\",\"count\":2,\"do\":[{\"op\":\"emit\",\"name\":{\"$fn\":\"concat\",\"args\":[\"gen-\",{\"$\":\"loop.index\"}]},\"requestMatch\":{\"method\":{\"$\":\"input.base.request_match.method\"},\"path\":{\"$fn\":\"concat\",\"args\":[{\"$\":\"vars.basePath\"},\"/v\",{\"$\":\"loop.index\"}]}},\"responseTemplate\":{\"status\":200,\"body\":{\"stableId\":{\"$fn\":\"randUUID\",\"args\":[]},\"n\":{\"$fn\":\"randInt\",\"args\":[1,10]}}},\"meta\":{\"from\":\"dsl\",\"i\":{\"$\":\"loop.index\"}}}]}]}",
  "baseMock": {
    "request_match": {
      "method": "GET",
      "path": "/base"
    }
  },
  "params": {},
  "limits": {
    "timeoutMs": 5000,
    "maxGeneratedMocks": 10,
    "maxResultBytes": 2000000
  }
}
